{
  "schema_version": 2,
  "layer_id": "river_id",
  "value_type": "integer",
  "cell_count": 112,
  "states": [
    2,
    2,
    2,
    2,
    2,
    2,
    2,
    2,
    2,
    2,
    2,
    2,
    2,
    2,
    2,
    2,
    2,
    2,
    2,
    2,
    2,
    2,
    2,
    2,
    2,
    2,
    2,
    2,
    2,
    2,
    2,
    2,
    2,
    2,
    2,
    2,
    2,
    2,
    2,
    2,
    2,
    2,
    2,
    2,
    2,
    2,
    2,
    2,
    2,
    2,
    2,
    2,
    2,
    2,
    2,
    2,
    2,
    2,
    2,
    2,
    2,
    2,
    2,
    2,
    2,
    2,
    2,
    2,
    2,
    2,
    2,
    2,
    2,
    2,
    2,
    2,
    2,
    2,
    2,
    2,
    2,
    2,
    2,
    2,
    2,
    2,
    2,
    2,
    2,
    2,
    2,
    2,
    2,
    2,
    2,
    2,
    2,
    2,
    2,
    2,
    2,
    2,
    2,
    2,
    2,
    2,
    2,
    2,
    2,
    2,
    2,
    2
  ],
  "values": [
    0,
    0,
    0,
    0,
    1,
    1,
    1,
    1,
    0,
    0,
    0,
    6,
    6,
    6,
    4,
    4,
    0,
    0,
    0,
    0,
    0,
    2,
    11,
    0,
    0,
    0,
    0,
    0,
    0,
    0,
    0,
    0,
    0,
    2,
    2,
    2,
    0,
    0,
    0,
    0,
    7,
    7,
    0,
    0,
    0,
    0,
    0,
    0,
    0,
    3,
    3,
    0,
    0,
    0,
    0,
    0,
    0,
    0,
    0,
    0,
    0,
    0,
    9,
    0,
    0,
    0,
    0,
    0,
    0,
    0,
    5,
    5,
    0,
    0,
    0,
    0,
    9,
    12,
    0,
    0,
    0,
    0,
    0,
    0,
    0,
    0,
    0,
    0,
    0,
    10,
    10,
    12,
    0,
    0,
    0,
    0,
    8,
    8,
    15,
    15,
    0,
    0,
    0,
    16,
    10,
    13,
    13,
    0,
    0,
    0,
    14,
    14
  ]
}