{
  "schema_version": 2,
  "layer_id": "elevation",
  "value_type": "integer",
  "cell_count": 112,
  "states": [
    2,
    2,
    2,
    2,
    2,
    2,
    2,
    2,
    2,
    2,
    2,
    2,
    2,
    2,
    2,
    2,
    2,
    2,
    2,
    2,
    2,
    2,
    2,
    2,
    2,
    2,
    2,
    2,
    2,
    2,
    2,
    2,
    2,
    2,
    2,
    2,
    2,
    2,
    2,
    2,
    2,
    2,
    2,
    2,
    2,
    2,
    2,
    2,
    2,
    2,
    2,
    2,
    2,
    2,
    2,
    2,
    2,
    2,
    2,
    2,
    2,
    2,
    2,
    2,
    2,
    2,
    2,
    2,
    2,
    2,
    2,
    2,
    2,
    2,
    2,
    2,
    2,
    2,
    2,
    2,
    2,
    2,
    2,
    2,
    2,
    2,
    2,
    2,
    2,
    2,
    2,
    2,
    2,
    2,
    2,
    2,
    2,
    2,
    2,
    2,
    2,
    2,
    2,
    2,
    2,
    2,
    2,
    2,
    2,
    2,
    2,
    2
  ],
  "values": [
    0,
    0,
    0,
    0,
    0,
    0,
    0,
    0,
    0,
    0,
    0,
    0,
    0,
    0,
    0,
    12,
    12,
    12,
    28,
    28,
    28,
    28,
    28,
    28,
    12,
    12,
    12,
    0,
    0,
    12,
    12,
    28,
    28,
    4,
    4,
    4,
    4,
    28,
    28,
    12,
    12,
    0,
    0,
    12,
    12,
    28,
    28,
    4,
    4,
    4,
    4,
    28,
    28,
    12,
    12,
    0,
    0,
    12,
    12,
    28,
    28,
    4,
    4,
    4,
    4,
    28,
    28,
    12,
    12,
    0,
    0,
    12,
    12,
    28,
    28,
    4,
    4,
    4,
    4,
    28,
    28,
    12,
    12,
    0,
    0,
    12,
    12,
    12,
    28,
    28,
    28,
    28,
    28,
    28,
    12,
    12,
    12,
    0,
    0,
    0,
    0,
    0,
    0,
    0,
    0,
    0,
    0,
    0,
    0,
    0,
    0,
    0
  ]
}
